{
  "contract_version": "creative-image-text-workspace/v1",
  "task": {},
  "intake": {},
  "direction": {},
  "draft": {
    "contract_version": "creative-image-text-draft/v2",
    "task_id": "creative_task_image_01",
    "version": 2,
    "direction_ref": {
      "direction_id": "creative_direction_01",
      "content_hash": "sha256:aaaaaaaaaaaaaaaaaaaaaaaaaaaaaaaaaaaaaaaaaaaaaaaaaaaaaaaaaaaaaaaa"
    },
    "input_identity_hash": "sha256:bbbbbbbbbbbbbbbbbbbbbbbbbbbbbbbbbbbbbbbbbbbbbbbbbbbbbbbbbbbbbbbb",
    "status": "draft",
    "title_candidates": ["标题一", "标题二", "标题三"],
    "selected_title": "标题一",
    "body": "正文",
    "topics": [],
    "cover_copy": "封面文案",
    "image_plan": [
      {"order": 1, "role": "cover", "purpose": "封面", "visual_brief": "封面画面", "caption": "封面", "overlay_copy": "封面文案", "layout_preset": "cover_center_v1"},
      {"order": 2, "role": "proof", "purpose": "证据", "visual_brief": "证据画面", "caption": "证据", "overlay_copy": "证据文案", "layout_preset": "proof_lower_left_v1"},
      {"order": 3, "role": "cta", "purpose": "行动", "visual_brief": "行动画面", "caption": "行动", "overlay_copy": "行动文案", "layout_preset": "cta_bottom_v1"}
    ],
    "created_at": "2026-07-31T08:00:00Z"
  },
  "slots": [
    {"order": 1, "role": "cover", "status": "empty", "selection_version": 0, "attempts": []},
    {"order": 2, "role": "proof", "status": "empty", "selection_version": 0, "attempts": []},
    {"order": 3, "role": "cta", "status": "empty", "selection_version": 0, "attempts": []}
  ],
  "readiness": {
    "draft_generation_ready": true,
    "image_generation_ready": true,
    "review_ready": false,
    "blocking_reasons": []
  }
}
